Bug,Area,Severity,Status,Fix Target,Notes,DevOps Risk
"Reminder sent 2 hours late",Notifications,Critical,Open,Before P2 Ships,"RT-4. Core product promise broken. CTO investigation underway (findings due Apr 18). Likely root cause: OS background task throttling (BGTaskScheduler / WorkManager). Recommended fix direction: server-triggered push — device receives, server schedules. If architectural, P2 expands 2+ sprints.","HIGHEST RISK. Zero delivery telemetry exists today. P2 initiative (Smarter Timing) is fully blocked until root cause is confirmed and fix is scoped. Do not ship P2 without this resolved."
"Trial paywall dismiss button clipped on small screens",Subscription,High,Open,This Sprint (PC-3),"PC-3. Conversion and App Store compliance risk. Users who cannot dismiss feel trapped — violates App Store guidelines. CTO estimate: <1 day fix (switch to scrollable sheet, keep dismiss button inside scroll container). Already in Tier 1 sprint plan.","Bounded fix. Ship this week. Monitor trial-to-paid conversion rate after it lands. App Store reviewers test on small devices — this is a rejection risk."
"Streak resets after timezone change",Retention,High,Investigating,Before P3 Ships,"SK-2. Root cause confirmed (CTO): local date vs UTC comparison. Fix: store last_contact_utc, calculate all streak windows in UTC, convert to local time for display only. Ship SK-6 timezone test suite (DST, date-line, mid-day changes) alongside fix — not after.","Retention damage compounds silently. Users who hit this churn without filing a bug. Not a current-sprint blocker but must not slip past P3. Watch streak break rate spike in monitoring after any timezone-adjacent deployment."
"Imported contact nickname not shown in setup",Onboarding,Medium,Open,This Sprint (OB-5),"OB-5. Reduces personal feel of onboarding. Small fix, already in Tier 1 sprint plan. Ships alongside OB-6 analytics instrumentation so the baseline is clean from day one.","Low operational risk. Confirm onboarding step 1 drop-off rate does not shift after this lands. Expected to be neutral or positive."
"Reply suggestion card flickers on refresh",Home feed,Low,Backlog,Backlog (P4),"Cosmetic. No impact on trust, reminders, onboarding, or conversion. Backlog indefinitely.","No release blocker. Do not prioritize over any trust-critical work. Revisit in P4."
